[
  {
    "id": "cr_hero_video",
    "name": "Hero Splash Video 15s",
    "campaignId": "cmp_ja_splash",
    "campaignName": "Summer Splash Awareness",
    "platform": "Meta",
    "parishes": ["Kingston"],
    "spend": 240000,
    "impressions": 160000,
    "clicks": 6200,
    "conversions": 480,
    "roas": 3.8,
    "ctr": 0.039,
    "thumbnailUrl": "https://dummyimage.com/80x80/1d4ed8/ffffff.png&text=SS"
  },
  {
    "id": "cr_pool_carousel",
    "name": "Poolside Carousel",
    "campaignId": "cmp_resort_getaway",
    "campaignName": "Island Resort Getaway",
    "platform": "Meta",
    "parishes": ["Saint James"],
    "spend": 175000,
    "impressions": 120500,
    "clicks": 4300,
    "conversions": 360,
    "roas": 4.1,
    "ctr": 0.036
  },
  {
    "id": "cr_search_headline",
    "name": "Luxury Resort | Official Site",
    "campaignId": "cmp_resort_getaway",
    "campaignName": "Island Resort Getaway",
    "platform": "Google",
    "parishes": ["Saint James"],
    "spend": 142000,
    "impressions": 98000,
    "clicks": 3900,
    "conversions": 320,
    "roas": 4.4,
    "ctr": 0.04
  },
  {
    "id": "cr_coffee_story",
    "name": "Farmer Story Carousel",
    "campaignId": "cmp_blue_mountain",
    "campaignName": "Blue Mountain Coffee Launch",
    "platform": "Meta",
    "parishes": ["Saint Andrew"],
    "spend": 98000,
    "impressions": 72000,
    "clicks": 3100,
    "conversions": 220,
    "roas": 2.9,
    "ctr": 0.043
  },
  {
    "id": "cr_tiktok_style",
    "name": "OOTD Street Style",
    "campaignId": "cmp_kgn_boutique",
    "campaignName": "Kingston Boutique Week",
    "platform": "TikTok",
    "parishes": ["Kingston"],
    "spend": 86500,
    "impressions": 68000,
    "clicks": 2750,
    "conversions": 180,
    "roas": 2.4,
    "ctr": 0.04,
    "thumbnailUrl": "https://dummyimage.com/80x80/f97316/ffffff.png&text=KB"
  }
]
